{"anchors":[{"engine":"methods","grid":{"n_components":[1,2,3]},"id":"raw_pls","method":"models.pls.pls_regression","preprocessing":"raw"},{"engine":"methods","grid":{"alpha":[0.01,0.1,1.0,10.0,100.0]},"id":"raw_ridge","method":"models.regularized.ridge","preprocessing":"raw"}],"content_version":"1.0.0","contexts":[{"continuous_support":{"reason":"QUALIFIED_CONTINUOUS_SUPPORT_NOT_IMPLEMENTED_FOR_THIS_TASK","status":"unavailable","value":null},"exact_full_moments":{"reason":"NOT_COMPUTED_FROM_TRUNCATED_TRAIN_PCA","status":"unavailable","value":null},"models":{"raw_pls":{"S":{"reason":null,"status":"computed","value":0.5941486363884666},"candidate_count":3,"native_inner_training_lineage_verified":true,"null":{"reason":null,"status":"computed","value":{"mae":{"reason":null,"status":"computed","value":2.6854408702380965},"r2":{"reason":null,"status":"computed","value":-37.74000662229333},"rmse":{"reason":null,"status":"computed","value":2.720786434144444}}},"scores":{"reason":null,"status":"computed","value":{"mae":{"reason":null,"status":"computed","value":1.018558460074896},"r2":{"reason":null,"status":"computed","value":-5.381072949631739},"rmse":{"reason":null,"status":"computed","value":1.104234884393284}}},"selected_parameters":{"n_components":3}},"raw_ridge":{"S":{"reason":null,"status":"computed","value":0.5531677668068955},"candidate_count":5,"native_inner_training_lineage_verified":true,"null":{"reason":null,"status":"computed","value":{"mae":{"reason":null,"status":"computed","value":2.6854408702380965},"r2":{"reason":null,"status":"computed","value":-37.74000662229333},"rmse":{"reason":null,"status":"computed","value":2.720786434144444}}},"scores":{"reason":null,"status":"computed","value":{"mae":{"reason":null,"status":"computed","value":1.1833592780497264},"r2":{"reason":null,"status":"computed","value":-6.734792710792607},"rmse":{"reason":null,"status":"computed","value":1.2157350784102652}}},"selected_parameters":{"alpha":1.0}}},"n_evaluation":70,"n_train":240,"source_type":"A","target_above_training_max":0,"target_below_training_min":70,"train_fitted_PC1_PC2_summaries":{"evaluation":[{"count":70.0,"max":5.703251889828545,"mean":-2.912896105201817,"median":-3.7843739015738107,"min":-7.573690169573324,"q25":-4.59256770442031,"q75":-2.2500243833245124,"sd":2.7549926251608428},{"count":70.0,"max":0.9377926982495495,"mean":0.3890478718276848,"median":0.4058550775822496,"min":-0.23851862439617705,"q25":0.20391949361094852,"q75":0.6065736190585196,"sd":0.2625377122135478}],"training":[{"count":240.0,"max":19.413089366470693,"mean":-6.179608732273821e-15,"median":-3.422820655860016,"min":-16.341005652982613,"q25":-8.394084974588946,"q75":9.700821722774386,"sd":10.093164145008204},{"count":240.0,"max":1.005883024153543,"mean":3.1850405256364235e-16,"median":-0.03846037724016679,"min":-0.8032293940795477,"q25":-0.30478705304406273,"q75":0.2950492306249362,"sd":0.40250904340839205}]},"training_target_summary":{"count":240.0,"max":9.786184,"mean":8.034592941666668,"median":8.0860895,"min":6.61803,"q25":7.783993500000001,"q75":8.44387075,"sd":0.6915645964239476}},{"continuous_support":{"reason":"QUALIFIED_CONTINUOUS_SUPPORT_NOT_IMPLEMENTED_FOR_THIS_TASK","status":"unavailable","value":null},"exact_full_moments":{"reason":"NOT_COMPUTED_FROM_TRUNCATED_TRAIN_PCA","status":"unavailable","value":null},"models":{"raw_pls":{"S":{"reason":null,"status":"computed","value":0.20670341910133327},"candidate_count":3,"native_inner_training_lineage_verified":true,"null":{"reason":null,"status":"computed","value":{"mae":{"reason":null,"status":"computed","value":0.925990282717391},"r2":{"reason":null,"status":"computed","value":-1.2592794100685953},"rmse":{"reason":null,"status":"computed","value":1.038577883350565}}},"scores":{"reason":null,"status":"computed","value":{"mae":{"reason":null,"status":"computed","value":0.6971968017735528},"r2":{"reason":null,"status":"computed","value":-0.42180851022975596},"rmse":{"reason":null,"status":"computed","value":0.8239002838589775}}},"selected_parameters":{"n_components":3}},"raw_ridge":{"S":{"reason":null,"status":"computed","value":0.6749720073177153},"candidate_count":5,"native_inner_training_lineage_verified":true,"null":{"reason":null,"status":"computed","value":{"mae":{"reason":null,"status":"computed","value":0.925990282717391},"r2":{"reason":null,"status":"computed","value":-1.2592794100685953},"rmse":{"reason":null,"status":"computed","value":1.038577883350565}}},"scores":{"reason":null,"status":"computed","value":{"mae":{"reason":null,"status":"computed","value":0.2582597198341959},"r2":{"reason":null,"status":"computed","value":0.7613225024021884},"rmse":{"reason":null,"status":"computed","value":0.3375668846696501}}},"selected_parameters":{"alpha":0.01}}},"n_evaluation":80,"n_train":230,"source_type":"C","target_above_training_max":0,"target_below_training_min":0,"train_fitted_PC1_PC2_summaries":{"evaluation":[{"count":80.0,"max":1.8872339216010112,"mean":-3.193226858471603,"median":-3.587692043071216,"min":-9.29131267867344,"q25":-5.4976034299395105,"q75":-0.5913114283974459,"sd":3.072387055551328},{"count":80.0,"max":0.7849456280650682,"mean":-0.03317445565972388,"median":0.006749534044957146,"min":-0.8305908853212518,"q25":-0.43521843700779766,"q75":0.32165731156159577,"sd":0.4468295086657707}],"training":[{"count":230.0,"max":19.248037542043285,"mean":-1.6778486351809366e-15,"median":-3.8517457650205174,"min":-16.50643743335184,"q25":-8.537832994181935,"q75":9.860656799222625,"sd":10.233123508128871},{"count":230.0,"max":0.92065439197317,"mean":-9.662338761452918e-17,"median":-0.034756932683457614,"min":-0.8604422009522109,"q25":-0.30910621782523096,"q75":0.3322737896328638,"sd":0.4064826320568357}]},"training_target_summary":{"count":230.0,"max":9.786184,"mean":7.228104747826087,"median":7.864757,"min":4.610245,"q25":5.67325425,"q75":8.2450855,"sd":1.393407779891332}},{"continuous_support":{"reason":"QUALIFIED_CONTINUOUS_SUPPORT_NOT_IMPLEMENTED_FOR_THIS_TASK","status":"unavailable","value":null},"exact_full_moments":{"reason":"NOT_COMPUTED_FROM_TRUNCATED_TRAIN_PCA","status":"unavailable","value":null},"models":{"raw_pls":{"S":{"reason":null,"status":"computed","value":0.4884137403327634},"candidate_count":3,"native_inner_training_lineage_verified":true,"null":{"reason":null,"status":"computed","value":{"mae":{"reason":null,"status":"computed","value":0.9194125146739127},"r2":{"reason":null,"status":"computed","value":-1.252162865634462},"rmse":{"reason":null,"status":"computed","value":1.0530936192450044}}},"scores":{"reason":null,"status":"computed","value":{"mae":{"reason":null,"status":"computed","value":0.448740471301852},"r2":{"reason":null,"status":"computed","value":0.4105628062916744},"rmse":{"reason":null,"status":"computed","value":0.5387482257489848}}},"selected_parameters":{"n_components":3}},"raw_ridge":{"S":{"reason":null,"status":"computed","value":0.2609654673867775},"candidate_count":5,"native_inner_training_lineage_verified":true,"null":{"reason":null,"status":"computed","value":{"mae":{"reason":null,"status":"computed","value":0.9194125146739127},"r2":{"reason":null,"status":"computed","value":-1.252162865634462},"rmse":{"reason":null,"status":"computed","value":1.0530936192450044}}},"scores":{"reason":null,"status":"computed","value":{"mae":{"reason":null,"status":"computed","value":0.649142784339417},"r2":{"reason":null,"status":"computed","value":-0.2300683876250733},"rmse":{"reason":null,"status":"computed","value":0.7782725506966988}}},"selected_parameters":{"alpha":0.01}}},"n_evaluation":80,"n_train":230,"source_type":"B","target_above_training_max":1,"target_below_training_min":0,"train_fitted_PC1_PC2_summaries":{"evaluation":[{"count":80.0,"max":24.743679842991682,"mean":18.264863160738624,"median":18.79688945167199,"min":10.9521080588374,"q25":15.055796830995547,"q75":21.591469462537287,"sd":3.759651399742554},{"count":80.0,"max":-0.48098557003349734,"mean":-1.1544389960457255,"median":-1.1939502057399873,"min":-1.9116712725774585,"q25":-1.4314966776198312,"q75":-0.829327255055468,"sd":0.36023288572470247}],"training":[{"count":230.0,"max":11.094536622493697,"mean":2.8002861810150785e-15,"median":0.4314918074204721,"min":-10.95707828948634,"q25":-3.2061571483853126,"q75":2.8445341239023634,"sd":4.350599093301237},{"count":230.0,"max":0.9525003178317978,"mean":-5.719108737102709e-16,"median":-0.01654549786813312,"min":-0.8435147237468364,"q25":-0.24628358618390173,"q75":0.2669860547618401,"sd":0.36249929633615874}]},"training_target_summary":{"count":230.0,"max":9.382422,"mean":7.225562782608696,"median":7.84874,"min":4.610245,"q25":5.67325425,"q75":8.288879999999999,"sd":1.390095045362442}},{"continuous_support":{"reason":"QUALIFIED_CONTINUOUS_SUPPORT_NOT_IMPLEMENTED_FOR_THIS_TASK","status":"unavailable","value":null},"exact_full_moments":{"reason":"NOT_COMPUTED_FROM_TRUNCATED_TRAIN_PCA","status":"unavailable","value":null},"models":{"raw_pls":{"S":{"reason":null,"status":"computed","value":0.5051461718887315},"candidate_count":3,"native_inner_training_lineage_verified":true,"null":{"reason":null,"status":"computed","value":{"mae":{"reason":null,"status":"computed","value":1.0068909353260866},"r2":{"reason":null,"status":"computed","value":-1.7482789211996321},"rmse":{"reason":null,"status":"computed","value":1.1175189164089885}}},"scores":{"reason":null,"status":"computed","value":{"mae":{"reason":null,"status":"computed","value":0.4248920385369813},"r2":{"reason":null,"status":"computed","value":0.3270006025221911},"rmse":{"reason":null,"status":"computed","value":0.5530085137717446}}},"selected_parameters":{"n_components":3}},"raw_ridge":{"S":{"reason":null,"status":"computed","value":0.6230212630268057},"candidate_count":5,"native_inner_training_lineage_verified":true,"null":{"reason":null,"status":"computed","value":{"mae":{"reason":null,"status":"computed","value":1.0068909353260866},"r2":{"reason":null,"status":"computed","value":